{
  "$schema": "./lifecycle.schema.json",
  "version": 4,
  "checkedAt": "2026-07-19",
  "apiDeprecations": [
    {
      "provider": "openai",
      "apiId": "assistants-api",
      "apiName": "Assistants API",
      "status": "deprecated",
      "shutdownDate": "2026-08-26",
      "replacement": "Responses API and Conversations API",
      "sourceUrl": "https://developers.openai.com/api/docs/deprecations",
      "sdk": "OpenAI Assistants",
      "notes": "Report only; the stateful Assistants migration is not a safe model-ID substitution."
    },
    {
      "provider": "openai",
      "apiId": "videos-api",
      "apiName": "Videos API",
      "status": "deprecated",
      "shutdownDate": "2026-09-24",
      "replacement": null,
      "sourceUrl": "https://developers.openai.com/api/docs/deprecations",
      "sdk": "OpenAI Videos",
      "notes": "The official deprecations page lists no replacement; never infer one."
    }
  ],
  "entries": [
    {
      "provider": "openai",
      "modelId": "gpt-5-2025-08-07",
      "status": "deprecated",
      "shutdownDate": "2026-12-11",
      "replacement": "gpt-5.5",
      "sourceUrl": "https://developers.openai.com/api/docs/deprecations",
      "replacementConfidence": "high",
      "notes": "Official substitute model."
    },
    {
      "provider": "openai",
      "modelId": "gpt-5-mini-2025-08-07",
      "status": "deprecated",
      "shutdownDate": "2026-12-11",
      "replacement": "gpt-5.4-mini",
      "sourceUrl": "https://developers.openai.com/api/docs/deprecations",
      "replacementConfidence": "high",
      "notes": "Official substitute model."
    },
    {
      "provider": "openai",
      "modelId": "gpt-5-nano-2025-08-07",
      "status": "deprecated",
      "shutdownDate": "2026-12-11",
      "replacement": "gpt-5.4-nano",
      "sourceUrl": "https://developers.openai.com/api/docs/deprecations",
      "replacementConfidence": "high",
      "notes": "Official substitute model."
    },
    {
      "provider": "openai",
      "modelId": "gpt-5-pro-2025-10-06",
      "status": "deprecated",
      "shutdownDate": "2026-12-11",
      "replacement": "gpt-5.5-pro",
      "sourceUrl": "https://developers.openai.com/api/docs/deprecations",
      "replacementConfidence": "high",
      "notes": "Official substitute model."
    },
    {
      "provider": "openai",
      "modelId": "o3-2025-04-16",
      "status": "deprecated",
      "shutdownDate": "2026-12-11",
      "replacement": "gpt-5.5",
      "sourceUrl": "https://developers.openai.com/api/docs/deprecations",
      "replacementConfidence": "high",
      "notes": "Official substitute model."
    },
    {
      "provider": "openai",
      "modelId": "o3-pro-2025-06-10",
      "status": "deprecated",
      "shutdownDate": "2026-12-11",
      "replacement": "gpt-5.5-pro",
      "sourceUrl": "https://developers.openai.com/api/docs/deprecations",
      "replacementConfidence": "high",
      "notes": "Official substitute model."
    },
    {
      "provider": "openai",
      "modelId": "gpt-5.2-chat-latest",
      "status": "deprecated",
      "shutdownDate": "2026-08-10",
      "replacement": "gpt-5.5",
      "sourceUrl": "https://developers.openai.com/api/docs/deprecations",
      "replacementConfidence": "high",
      "notes": "Official substitute model."
    },
    {
      "provider": "openai",
      "modelId": "gpt-5.3-chat-latest",
      "status": "deprecated",
      "shutdownDate": "2026-08-10",
      "replacement": "gpt-5.5",
      "sourceUrl": "https://developers.openai.com/api/docs/deprecations",
      "replacementConfidence": "high",
      "notes": "Official substitute model."
    },
    {
      "provider": "openai",
      "modelId": "computer-use-preview-2025-03-11",
      "status": "deprecated",
      "shutdownDate": "2026-07-23",
      "replacement": "gpt-5.4-mini",
      "sourceUrl": "https://developers.openai.com/api/docs/deprecations",
      "replacementConfidence": "high",
      "notes": "Official substitute model; tool behavior still requires compatibility tests."
    },
    {
      "provider": "openai",
      "modelId": "computer-use-preview",
      "status": "deprecated",
      "shutdownDate": "2026-07-23",
      "replacement": "gpt-5.4-mini",
      "sourceUrl": "https://developers.openai.com/api/docs/deprecations",
      "replacementConfidence": "high",
      "notes": "Alias listed with the deprecated snapshot in the official table."
    },
    {
      "provider": "openai",
      "modelId": "gpt-4o-mini-search-preview-2025-03-11",
      "status": "deprecated",
      "shutdownDate": "2026-07-23",
      "replacement": "gpt-5.4-mini",
      "sourceUrl": "https://developers.openai.com/api/docs/deprecations",
      "replacementConfidence": "high",
      "notes": "Official substitute model; search tool behavior requires compatibility tests."
    },
    {
      "provider": "openai",
      "modelId": "gpt-4o-search-preview-2025-03-11",
      "status": "deprecated",
      "shutdownDate": "2026-07-23",
      "replacement": "gpt-5.4-mini",
      "sourceUrl": "https://developers.openai.com/api/docs/deprecations",
      "replacementConfidence": "high",
      "notes": "Official substitute model; search tool behavior requires compatibility tests."
    },
    {
      "provider": "openai",
      "modelId": "gpt-4o-mini-tts-2025-03-20",
      "status": "deprecated",
      "shutdownDate": "2026-07-23",
      "replacement": "gpt-4o-mini-tts-2025-12-15",
      "sourceUrl": "https://developers.openai.com/api/docs/deprecations",
      "replacementConfidence": "high",
      "notes": "Official same-modality substitute snapshot."
    },
    {
      "provider": "openai",
      "modelId": "gpt-5-chat-latest",
      "status": "deprecated",
      "shutdownDate": "2026-07-23",
      "replacement": "gpt-5.5",
      "sourceUrl": "https://developers.openai.com/api/docs/deprecations",
      "replacementConfidence": "high",
      "notes": "Official substitute model."
    },
    {
      "provider": "openai",
      "modelId": "gpt-5-codex",
      "status": "deprecated",
      "shutdownDate": "2026-07-23",
      "replacement": "gpt-5.5",
      "sourceUrl": "https://developers.openai.com/api/docs/deprecations",
      "replacementConfidence": "high",
      "notes": "Official substitute model."
    },
    {
      "provider": "openai",
      "modelId": "gpt-5.1-chat-latest",
      "status": "deprecated",
      "shutdownDate": "2026-07-23",
      "replacement": "gpt-5.5",
      "sourceUrl": "https://developers.openai.com/api/docs/deprecations",
      "replacementConfidence": "high",
      "notes": "Official substitute model."
    },
    {
      "provider": "openai",
      "modelId": "gpt-5.1-codex",
      "status": "deprecated",
      "shutdownDate": "2026-07-23",
      "replacement": "gpt-5.5",
      "sourceUrl": "https://developers.openai.com/api/docs/deprecations",
      "replacementConfidence": "high",
      "notes": "Official substitute model."
    },
    {
      "provider": "openai",
      "modelId": "gpt-5.1-codex-max",
      "status": "deprecated",
      "shutdownDate": "2026-07-23",
      "replacement": "gpt-5.5",
      "sourceUrl": "https://developers.openai.com/api/docs/deprecations",
      "replacementConfidence": "high",
      "notes": "Official substitute model."
    },
    {
      "provider": "openai",
      "modelId": "gpt-5.1-codex-mini",
      "status": "deprecated",
      "shutdownDate": "2026-07-23",
      "replacement": "gpt-5.4-mini",
      "sourceUrl": "https://developers.openai.com/api/docs/deprecations",
      "replacementConfidence": "high",
      "notes": "Official substitute model."
    },
    {
      "provider": "openai",
      "modelId": "gpt-5.2-codex",
      "status": "deprecated",
      "shutdownDate": "2026-07-23",
      "replacement": "gpt-5.5",
      "sourceUrl": "https://developers.openai.com/api/docs/deprecations",
      "replacementConfidence": "high",
      "notes": "Official substitute model."
    },
    {
      "provider": "openai",
      "modelId": "gpt-audio-mini-2025-10-06",
      "status": "deprecated",
      "shutdownDate": "2026-07-23",
      "replacement": "gpt-audio-1.5",
      "sourceUrl": "https://developers.openai.com/api/docs/deprecations",
      "replacementConfidence": "high",
      "notes": "Official audio substitute model."
    },
    {
      "provider": "openai",
      "modelId": "gpt-realtime-mini-2025-10-06",
      "status": "deprecated",
      "shutdownDate": "2026-07-23",
      "replacement": "gpt-realtime-mini",
      "sourceUrl": "https://developers.openai.com/api/docs/deprecations",
      "replacementConfidence": "high",
      "notes": "Official realtime substitute model."
    },
    {
      "provider": "openai",
      "modelId": "o3-deep-research-2025-06-26",
      "status": "deprecated",
      "shutdownDate": "2026-07-23",
      "replacement": "gpt-5.5-pro",
      "sourceUrl": "https://developers.openai.com/api/docs/deprecations",
      "replacementConfidence": "high",
      "notes": "Official substitute model."
    },
    {
      "provider": "openai",
      "modelId": "o3-deep-research",
      "status": "deprecated",
      "shutdownDate": "2026-07-23",
      "replacement": "gpt-5.5-pro",
      "sourceUrl": "https://developers.openai.com/api/docs/deprecations",
      "replacementConfidence": "high",
      "notes": "Alias listed with the deprecated snapshot in the official table."
    },
    {
      "provider": "openai",
      "modelId": "o4-mini-deep-research-2025-06-26",
      "status": "deprecated",
      "shutdownDate": "2026-07-23",
      "replacement": "gpt-5.5-pro",
      "sourceUrl": "https://developers.openai.com/api/docs/deprecations",
      "replacementConfidence": "high",
      "notes": "Official substitute model."
    },
    {
      "provider": "openai",
      "modelId": "o4-mini-deep-research",
      "status": "deprecated",
      "shutdownDate": "2026-07-23",
      "replacement": "gpt-5.5-pro",